### ISSUE TITLE
使用systemtap阅读wrk源码

### ISSUE THREAD

**Issue by WALL-E** [WALL-E/systemtap-practice#7]
wrk代码是集大成者，包含有时下很多流行元素,但代码规模很小，只有6000行左右，非常适合细致研究。
* Reactor模式
  * 复用Redis的aeEvent框架
* 内置脚本语言
  * 支持luajit
* 支持HTTP协议
  * 借鉴Nginx/Node.js
* 多线程模型

### 下载wrk
```
git clone https://github.com/wg/wrk.git
```

### 编译
首先修改Makefile, 打开调试模式
```
# head -2 Makefile
CFLAGS  += -std=c99 -Wall -O0 -g -D_REENTRANT
LIBS    := -lpthread -lm -lssl -lcrypto

# make

# nm wrk|grep -i Main
000000000044b4c1 T aeMain
                 U __libc_start_main@@GLIBC_2.2.5
0000000000445a30 T main
00000000004463dd t thread_main
```

### 运行
```
# ./wrk -t 1 -c 1 -d 10 http://www.baidu.com/
Running 10s test @ http://www.baidu.com/
  1 threads and 1 connections
  Thread Stats   Avg      Stdev     Max   +/- Stdev
    Latency   144.87ms   51.84ms 296.02ms   71.01%
    Req/Sec     7.27      3.19    18.00     57.58%
  68 requests in 10.03s, 1.00MB read
Requests/sec:      6.78
Transfer/sec:    101.75KB
```
如果需要使用systemtap采集栈数据的时候，可以适当延长wrk的运行时长。

**Comment by WALL-E** [comment]
## 安装systemtap环境
请参考https://github.com/zz-practices/systemtap-practice

## 下载工具集
```
git clone https://github.com/openresty/openresty-systemtap-toolkit.git
git clone https://github.com/brendangregg/FlameGraph.git
```

**Comment by WALL-E** [comment]
# 生成火焰图

```
openresty-systemtap-toolkit/sample-bt -p `pgrep wrk` -t 30 -u > a.bt

FlameGraph/stackcollapse-stap.pl a.bt  > a.cbt

FlameGraph/flamegraph.pl a.cbt > a.svg
```

**Comment by WALL-E** [comment]
# 函数执行路径
![img](http://oo2fuseka.bkt.clouddn.com/wrk-sourcecode.svg)
[原图](http://oo2fuseka.bkt.clouddn.com/wrk-sourcecode.svg)

**Comment by WALL-E** [comment]
# 函数socket_writeable
先来看看其中一个函数socket_writeable()

* 第一个执行路径: socket写出数据
![image](http://om1jh86mb.bkt.clouddn.com/wrk-socket_writeable.png)

* 第二个执行路径: 删除一个事件
![image](http://om1jh86mb.bkt.clouddn.com/wrk-socket_writeable_2.png)

**Comment by WALL-E** [comment]
## 对照源码
```C
static void socket_writeable(aeEventLoop *loop, int fd, void *data, int mask) {
    connection *c = data;
    thread *thread = c->thread;

    if (c->delayed) {
        uint64_t delay = script_delay(thread->L);
        aeDeleteFileEvent(loop, fd, AE_WRITABLE);
        aeCreateTimeEvent(loop, delay, delay_request, c, NULL);
        return;
    }

    if (!c->written) {
        if (cfg.dynamic) {
            script_request(thread->L, &c->request, &c->length);
        }
        c->start   = time_us();
        c->pending = cfg.pipeline;
    }

    char  *buf = c->request + c->written;
    size_t len = c->length  - c->written;
    size_t n;

    switch (sock.write(c, buf, len, &n)) {
        case OK:    break;
        case ERROR: goto error;
        case RETRY: return;
    }

    c->written += n;
    if (c->written == c->length) {
        c->written = 0;
        aeDeleteFileEvent(loop, fd, AE_WRITABLE);
    }

    error:
        thread->errors.write++;
        reconnect_socket(thread, c);
}
```
对比源码，可以发现几个问题
systemtap对栈数据采样，并不能保证能够采集到程序的所有执行路径，有几个原因
* 程序执行时，一些代码路径可能执行不到
  * 例如，goto语句一般情况下就不会执行
* systemtap一定时间间隔采集一次，所以可能会丢失一部分栈数据

至少，从火焰图中我们发现程序运行的关键路径。

**Comment by WALL-E** [comment]
## 耗时分布

程序的关键函数:aeProcessEvents

* socket_readable      69.96%
* socket_writeable     15.64%
* aeApiPoll                  11.80%
* processTimeEvents 1.10%
* aeGetTime                0.69%

**Comment by WALL-E** [comment]
# Todo
Q: 解释为什么读函数比写函数耗时多？
A: 比较读写数据量

```
172.28.32.101.35938 > 220.181.112.244.80: Flags [P.], seq 1:78, ack 1, win 229, length 77
220.181.112.244.80 > 172.28.32.101.35938: Flags [.], ack 78, win 193, length 0
220.181.112.244.80 > 172.28.32.101.35938: Flags [P.], seq 1:401, ack 78, win 193, length 400
172.28.32.101.35938 > 220.181.112.244.80: Flags [.], ack 401, win 237, length 0
220.181.112.244.80 > 172.28.32.101.35938: Flags [P.], seq 401:2782, ack 78, win 193, length 2381
```
使用Tcpdump抓包(删除了部分无关紧要的数据)，看到请求体是77字节，响应体是2781,两者比例是1:36。
从内存拷贝的角度来看，这样的数据是可以解释读接口比写接口耗时。

## Todo
有兴趣的话，可以再找一个请求体比响应体大的接口，从另外一个方面开应征这个观点。

**Comment by WALL-E** [comment]
# Todo

Q: aeApiPoll占用了11.80%，合理吗，怎么解释
A: 增加并发连接数


实验数据
* 并发连接数30
  * aeApiPoll占用了10.80%
* 并发连接数120
  * aeApiPoll占用了19.22%
* 并发连接数200
  * aeApiPoll占用了18.54%

看起来是网络不稳定造成的，办公网无法做准确的测试。

**Comment by WALL-E** [comment]
## Todo

错误信息代表什么含义？
```
openresty-systemtap-toolkit/sample-bt -p `pgrep wrk` -t 30 -u > a.bt
WARNING: Tracing 477 (/root/wrk/wrk) in user-space only...
WARNING: Missing unwind data for a module, rerun with 'stap -d (unknown; retry with -DDEBUG_UNWIND)'
WARNING: no or bad debug frame hdr
WARNING: No binary search table for eh frame, doing slow linear search for stap_a733ce9852e94ef9047463c7e29a2745__489
WARNING: _stp_read_address failed to access memory location
WARNING: DWARF expression stack underflow in CFI
WARNING: Time's up. Quitting now...(it may take a while)
WARNING: Number of errors: 0, skipped probes: 8
```

**Comment by WALL-E** [comment]
## __read_nocancel() 是什么？

glibc-2.25/sysdeps/unix/sysv/linux/not-cancel.h
```
/* Uncancelable read.  */
#define __read_nocancel(fd, buf, len) \
  INLINE_SYSCALL (read, 3, fd, buf, len)
```

由于在采集栈数据的时候，使用-u参数，意思是只采集用户态的栈数据，因此，可以认为函数__read_nocancel是进程陷入内容之前运行的最后一个函数。
